{
    "entry_script":  "scripts/main.luau",
    "main_scene":  "scenes/main.scene.json",
    "name":  "Synthetic spatial batch author trial",
    "systems":  {
                    "audio":  false,
                    "camera2d":  false,
                    "camera3d":  false,
                    "effekseer":  false,
                    "jobs":  false,
                    "particle":  false,
                    "physics2d":  false,
                    "physics3d":  false,
                    "random":  false,
                    "save":  false,
                    "spine":  false,
                    "ui":  false
                },
    "test_files":  [

                   ]
}
